{
  "catalogVersion": "sha256:d725607c7c1ea750b721adf3285d741dac1d572e296c2f013369ef85f9e36b9a",
  "generatedAt": "2026-09-16T15:01:22.673881+00:00",
  "schemaVersion": "2.0.0",
  "sources": [
    {
      "checkedAt": "2026-09-16T15:01:22.673881+00:00",
      "consecutiveFailures": 0,
      "id": "health:bdns",
      "lastSuccessAt": "2026-09-16T15:01:22.673881+00:00",
      "recordCount": 8,
      "schemaVersion": "2.0.0",
      "sourceKey": "bdns",
      "status": "healthy"
    },
    {
      "checkedAt": "2026-09-16T15:01:22.673881+00:00",
      "consecutiveFailures": 0,
      "id": "health:boe",
      "lastSuccessAt": "2026-09-16T15:01:22.673881+00:00",
      "recordCount": 78,
      "schemaVersion": "2.0.0",
      "sourceKey": "boe",
      "status": "healthy"
    },
    {
      "checkedAt": "2026-09-16T15:01:22.673881+00:00",
      "consecutiveFailures": 0,
      "id": "health:bopa",
      "lastSuccessAt": "2026-09-16T15:01:22.673881+00:00",
      "recordCount": 26,
      "schemaVersion": "2.0.0",
      "sourceKey": "bopa",
      "status": "healthy"
    },
    {
      "checkedAt": "2026-09-16T15:01:22.673881+00:00",
      "consecutiveFailures": 0,
      "id": "health:eu",
      "lastSuccessAt": "2026-09-16T15:01:22.673881+00:00",
      "recordCount": 79,
      "schemaVersion": "2.0.0",
      "sourceKey": "eu",
      "status": "healthy"
    }
  ]
}
